{
  "$schema": "./profile.schema.json",
  "version": 1,
  "name": "Default",
  "ports": { "input": "padKONTROL", "output": "totalKONTROL" },
  "startBank": 0,
  "banks": [
    {
      "name": "Drums",
      "display": "DRM",
      "pads": {
        "1": { "type": "note", "channel": 10, "note": 36 },
        "2": { "type": "note", "channel": 10, "note": 37 },
        "3": { "type": "note", "channel": 10, "note": 38 },
        "4": { "type": "note", "channel": 10, "note": 39 },
        "5": { "type": "note", "channel": 10, "note": 40 },
        "6": { "type": "note", "channel": 10, "note": 41 },
        "7": { "type": "note", "channel": 10, "note": 42 },
        "8": { "type": "note", "channel": 10, "note": 43 },
        "9": { "type": "note", "channel": 10, "note": 44 },
        "10": { "type": "note", "channel": 10, "note": 45 },
        "11": { "type": "note", "channel": 10, "note": 46 },
        "12": { "type": "note", "channel": 10, "note": 47 },
        "13": { "type": "note", "channel": 10, "note": 48 },
        "14": { "type": "note", "channel": 10, "note": 49 },
        "15": { "type": "note", "channel": 10, "note": 50 },
        "16": { "type": "note", "channel": 10, "note": 51 }
      },
      "buttons": {
        "setting": { "type": "switchBank", "bank": 1 },
        "scene": { "type": "note", "channel": 1, "note": 1, "mode": "toggle" },
        "message": { "type": "note", "channel": 1, "note": 2, "mode": "toggle" },
        "noteCc": { "type": "note", "channel": 1, "note": 3, "mode": "toggle" },
        "midiCh": { "type": "note", "channel": 1, "note": 4, "mode": "toggle" },
        "swType": { "type": "note", "channel": 1, "note": 5, "mode": "toggle" },
        "relVal": { "type": "note", "channel": 1, "note": 6, "mode": "toggle" },
        "velocity": { "type": "note", "channel": 1, "note": 7, "mode": "toggle" },
        "port": { "type": "note", "channel": 1, "note": 8, "mode": "toggle" },
        "fixedVelocity": { "type": "note", "channel": 1, "note": 9, "mode": "toggle" },
        "progChange": { "type": "note", "channel": 1, "note": 10, "mode": "toggle" },
        "x": { "type": "note", "channel": 1, "note": 11 },
        "y": { "type": "note", "channel": 1, "note": 12 },
        "knob1Assign": { "type": "note", "channel": 1, "note": 13, "mode": "toggle" },
        "knob2Assign": { "type": "note", "channel": 1, "note": 14, "mode": "toggle" },
        "pedal": { "type": "note", "channel": 1, "note": 15 },
        "roll": { "type": "roll" },
        "flam": { "type": "flam" },
        "hold": { "type": "note", "channel": 1, "note": 18, "mode": "toggle" }
      },
      "knobs": {
        "1": { "type": "cc", "channel": 1, "cc": 1 },
        "2": { "type": "cc", "channel": 1, "cc": 2 }
      },
      "xy": { "type": "xy", "channel": 1, "ccX": 3, "ccY": 4 },
      "encoder": { "type": "cc", "channel": 1, "cc": 10 }
    },
    {
      "name": "Clips",
      "display": "CLP",
      "pads": {
        "1": { "type": "note", "channel": 2, "note": 60, "velocity": 127, "led": "follow" },
        "2": { "type": "note", "channel": 2, "note": 61, "velocity": 127, "led": "follow" },
        "3": { "type": "note", "channel": 2, "note": 62, "velocity": 127, "led": "follow" },
        "4": { "type": "note", "channel": 2, "note": 63, "velocity": 127, "led": "follow" },
        "5": { "type": "note", "channel": 2, "note": 64, "velocity": 127, "led": "follow" },
        "6": { "type": "note", "channel": 2, "note": 65, "velocity": 127, "led": "follow" },
        "7": { "type": "note", "channel": 2, "note": 66, "velocity": 127, "led": "follow" },
        "8": { "type": "note", "channel": 2, "note": 67, "velocity": 127, "led": "follow" },
        "9": { "type": "note", "channel": 2, "note": 68, "velocity": 127, "led": "follow" },
        "10": { "type": "note", "channel": 2, "note": 69, "velocity": 127, "led": "follow" },
        "11": { "type": "note", "channel": 2, "note": 70, "velocity": 127, "led": "follow" },
        "12": { "type": "note", "channel": 2, "note": 71, "velocity": 127, "led": "follow" },
        "13": { "type": "note", "channel": 2, "note": 72, "velocity": 127, "led": "follow" },
        "14": { "type": "note", "channel": 2, "note": 73, "velocity": 127, "led": "follow" },
        "15": { "type": "note", "channel": 2, "note": 74, "velocity": 127, "led": "follow" },
        "16": { "type": "note", "channel": 2, "note": 75, "velocity": 127, "led": "follow" }
      },
      "buttons": {
        "setting": { "type": "switchBank", "bank": 0 },
        "x": { "type": "cc", "channel": 2, "cc": 20 },
        "y": { "type": "cc", "channel": 2, "cc": 21 },
        "pedal": { "type": "switchBank", "bank": 0, "momentary": true }
      },
      "knobs": {
        "1": { "type": "cc", "channel": 2, "cc": 7 },
        "2": { "type": "cc", "channel": 2, "cc": 10, "min": 32, "max": 96 }
      },
      "xy": { "type": "xy", "channel": 2, "ccX": 3, "ccY": 4 },
      "encoder": { "type": "cc", "channel": 2, "cc": 11, "encoding": "absolute" }
    }
  ]
}
